<?xml version="1.0" encoding="ISO-8859-1"?>
<?xml-stylesheet type="text/xsl" href="poema_xml_to_txt.xsl"?>
<poema xsi:noNamespaceSchemaLocation="poema.xsd" xmlns:xsi="http://www.w3.org/2001/XMLSchema-instance">
<autor>Luís de Camões</autor>
<título>Ao desconcerto do Mundo</título>
<estrofe>
         <verso><sílaba>Os</sílaba> <sílaba>bons</sílaba> <sílaba>vi</sílaba> <sílaba>sem</sílaba><sílaba>pre</sílaba> <sílaba>pa</sílaba><sílaba>ssar</sílaba></verso>
         <verso><sílaba>no</sílaba> <sílaba>Mun</sílaba><sílaba>do</sílaba> <sílaba>gran</sílaba><sílaba>des</sílaba> <sílaba>tor</sílaba><sílaba>men</sílaba><sílaba>tos</sílaba>;</verso>
         <verso><sílaba>e</sílaba> <sílaba>pe</sílaba><sílaba>ra</sílaba> <sílaba>ma</sílaba><sílaba>is</sílaba> <sílaba>me</sílaba> <sílaba>es</sílaba><sílaba>pan</sílaba><sílaba>tar</sílaba>,</verso>
         <verso><sílaba>em</sílaba> <sílaba>mar</sílaba> <sílaba>de</sílaba> <sílaba>con</sílaba><sílaba>ten</sílaba><sílaba>ta</sílaba><sílaba>men</sílaba><sílaba>tos</sílaba>.</verso>
</estrofe>
<estrofe>
         <verso><sílaba>Cui</sílaba><sílaba>dan</sílaba><sílaba>do</sílaba> <sílaba>al</sílaba><sílaba>can</sílaba><sílaba>çar</sílaba> <sílaba>a</sílaba><sílaba>ssim</sílaba></verso>
         <verso><sílaba>o</sílaba> <sílaba>bem</sílaba> <sílaba>tão</sílaba> <sílaba>mal</sílaba> <sílaba>or</sílaba><sílaba>de</sílaba><sílaba>na</sílaba><sílaba>do</sílaba>,</verso>
         <verso><sílaba>fui</sílaba> <sílaba>mau</sílaba>, <sílaba>mas</sílaba> <sílaba>fui</sílaba> <sílaba>cas</sílaba><sílaba>ti</sílaba><sílaba>ga</sílaba><sílaba>do</sílaba>:</verso>
         <verso><sílaba>a</sílaba><sílaba>ssim</sílaba> <sílaba>que</sílaba>, <sílaba>só</sílaba> <sílaba>pe</sílaba><sílaba>ra</sílaba> <sílaba>mim</sílaba>,</verso>
         <verso><sílaba>an</sílaba><sílaba>da</sílaba> <sílaba>o</sílaba> <sílaba>Mun</sílaba><sílaba>do</sílaba> <sílaba>con</sílaba><sílaba>cer</sílaba><sílaba>ta</sílaba><sílaba>do</sílaba>.</verso>
</estrofe>
</poema>
